"code","address","city","state","zip","square_footage","year_opened","county_fips","county_name","description","placenames","oc_formatted","oc_lat","oc_lng"
"87X2","1625 Hutton Drive","Carrollton","Texas","75006-6610",235900,2019,48113,"Dallas","Mini Fulfillment Center / Amazon Fresh / Delivery Station for Dallas with Same Day Delivery Service within 45 Minutes Drive Time.","1625 Hutton Drive, Carrollton, Texas, 75006-6610","Amazon STX2, 1625 Hutton Drive, Carrollton, TX 75006, United States of America",32.943477,-96.909816
"DFW5","4121 International Pkwy","Carrollton","Texas","75007",146000,2010,48121,"Denton","Amazon's Wootl Apparel Manufacturing Plant in Dallas Area","4121 International Pkwy, Carrollton, Texas, 75007","4121 International Parkway, Carrollton, TX 75007, United States of America",33.020815,-96.8476499
"DFW6","940 W Bethel Road","Coppell","Texas","75019-4424",1053400,2013,48113,"Dallas","Large Non-Sortable (televisions, furniture and electronics)","940 W Bethel Road, Coppell, Texas, 75019-4424","Amazon Fulfilment Center DFW6, 940 West Bethel Road, Coppell, TX 75019, United States of America",32.9580471,-97.0170373
"FTW7/FTW9","944 W Sandy Lake Road","Coppell","Texas","75019-3989",604800,2017,48113,"Dallas","FTW7 is Make on Demand, FTW9 is a Specialty FC for shoes launched in October  2019","944 W Sandy Lake Road, Coppell, Texas, 75019-3989","West Sandy Lake Road, Coppell, TX 75019, United States of America",32.9692729,-96.9938566
"FTW2/HDA9","2701 West Bethel Road","Coppell","Texas","75019",104160,2016,48113,"Dallas","FTW2 is Large Non-Sortable HDA9 is a co- located Heavy/Bulky Delivery Station","2701 West Bethel Road, Coppell, Texas, 75019","Amazon FTW2, 2701 West Bethel Road, Coppell, TX 75019, United States of America",32.9517549,-97.0269337
"FTW5","1475 Akron Way Kaufman","Forney","Texas","75126-3566",1080000,2021,48257,"Kaufman","Role of building TBD. Project Forney.","1475 Akron Way Kaufman, Forney, Texas, 75126-3566","Amazon FTW5, 1475 Akron Way, Forney, TX 75126, United States of America",32.7343958,-96.4164978
"PTX1","2101 Danieldale Road","Lancaster","Texas","75134-1551",NA,2018,48113,"Dallas","Amazon uses a portion of this space as a seasonal facility","2101 Danieldale Road, Lancaster, Texas, 75134-1551","Danieldale Road, Lancaster, TX 75134, United States of America",32.6358811,-96.7982443
"","1400 Southport Parkway Building #1","Wilmer","Texas","75172-1265",107530,2021,48113,"Dallas","New Fulfillment Center in Wilmer","1400 Southport Parkway Building #1, Wilmer, Texas, 75172-1265","Southport Tack, Kemp, TX, United States of America",32.255167,-96.144394
"DAL3","1301 Chalk Hill Road","Dallas","Texas","75211",855000,2020,48113,"Dallas","Sortable 1,500 associates to be hired","1301 Chalk Hill Road, Dallas, Texas, 75211","1301 Chalk Hill Road, Dallas, TX 75212, United States of America",32.7520501,-96.9023391
"37X3","4445 Rock Quarry Road #400","Dallas","Texas","75211-1409",175400,2021,48113,"Dallas","Mini Fulfillment Center/ Amazon Fresh / Delivery Station for Dallas with Same Day Delivery Service within 45 Minutes Drive Time","4445 Rock Quarry Road #400, Dallas, Texas, 75211-1409","4445 Rock Quarry Road, Dallas, TX 75211, United States of America",32.752978,-96.8895253
"FTW8","3351 Balmorhea Dr","Dallas","Texas","75241-7304",918800,2017,48113,"Dallas","Seasonal Facility","3351 Balmorhea Dr, Dallas, Texas, 75241-7304","Balmorhea Drive, Dallas, TX 75134, United States of America",32.6338117,-96.7694637
"IAH1","9155 Southlink Drive","Dallas","Texas","75241-7510",1004000,2021,48113,"Dallas","Role of building TBD.","9155 Southlink Drive, Dallas, Texas, 75241-7510","Dallas, Texas, United States of America",32.660114,-96.759227
"DAL2","2601 S Airfield Drive","Dallas","Texas","75261",1000000,2020,48439,"Tarrant","Non-Sortable","2601 S Airfield Drive, Dallas, Texas, 75261","Amazon DAL2, 2601 South Airfield Drive, Irving, TX 75261, United States of America",32.8650201,-97.0294277
"FTW6","2601 W Bethel Road, Grapevine","Coppell","Texas","75261-4034",100280,2018,48439,"Tarrant","Small Sortable","2601 W Bethel Road, Grapevine, Coppell, Texas, 75261-4034","West Bethel Road, Coppell, TX 75019, United States of America",32.9550735,-97.0279877
"","E Airfield Drive & Valley View Lane","Dallas","Texas","75261",517500,2021,48439,"Tarrant","Role of building TBD Project not yet confirmed.","E Airfield Drive & Valley View Lane, Dallas, Texas, 75261","Dallas, Texas, United States of America",32.905321,-97.066536
"","1851 NE Loop 820","Fort Worth","Texas","76106",1023500,2021,48439,"Tarrant","Facility likely Large Non-Sortable.","1851 NE Loop 820, Fort Worth, Texas, 76106","NE Loop 820, Fort Worth, TX, United States of America",32.839799,-97.330272
"AFW1","1511 NE Loop 820 N","Fort Worth","Texas","76108-9755",465500,2021,48439,"Tarrant","Role of building TBD","1511 NE Loop 820 N, Fort Worth, Texas, 76108-9755","W Loop 820 S, Fort Worth, TX, United States of America",32.745824,-97.481703
"XUSB","14900 Frye Road","Fort Worth","Texas","76155-2726",495000,2014,48439,"Tarrant","Large Non-Sortable (e g. canoes, fishing rods) Fulfillment center is outsourced to 3PL XPO Logistics","14900 Frye Road, Fort Worth, Texas, 76155-2726","14900 Frye Road, Fort Worth, TX 76155, United States of America",32.8182803,-97.0428728
"DFW7","700 Westport Parkway Haslet","Fort Worth","Texas","76177-4513",1200000,2013,48439,"Tarrant","Small Sortable (Ships smaller items like books, small electronics and DVDs) Facility budgeted at S100 Million. Expanded in 2015 for $21.5 Million.","700 Westport Parkway Haslet, Fort Worth, Texas, 76177-4513","Amazon Fulfillment Center DFW7, 700 Westport Parkway, Fort Worth, TX 76177, United States of America",32.9705254,-97.3357107
"FTW3/FTW4","15201 Heritage Parkway","Fort Worth","Texas","76177-2517",1000000,2016,48439,"Tarrant","FTW3 is the VNA side of the FC with Softlines FTW4 is a Quick Deploy (QD) Fulfillment Center which is a hybrid small sortable FC. Print on Demand Book facility. Amazon Fresh facility","15201 Heritage Parkway, Fort Worth, Texas, 76177-2517","Heritage Parkway, Fort Worth, TX 76177, United States of America",32.9726128,-97.3125968
"AUS3","1878 Exchange Parkway Waco","Waco","Texas","76712-6903",640000,2021,48309,"McLennan","Small Sortable","1878 Exchange Parkway Waco, Waco, Texas, 76712-6903","Exchange Parkway, Waco, TX 76711, United States of America",31.494631,-97.173893
"HOU2","10550 Ella Boulevard","Houston","Texas","77038-2324",855000,2017,48201,"Harris","Small Sortable: Products < 25 Lbs","10550 Ella Boulevard, Houston, Texas, 77038-2324","Amazon HOU2, 10550 Ella Boulevard, North Houston District, TX 77038, United States of America",29.9341403,-95.4283824
"17X2/HHO2","6911 Fairbanks N","Houston","Texas","77040",252000,2019,48201,"Harris","ITX2 is a Specialty Small and Light Products FC, HHO2 is a Heavy/Bulky Delivery Station","6911 Fairbanks N, Houston, Texas, 77040","Fairbanks North Houston Road, Fairbanks, Houston, TX 77064, United States of America",29.8589106,-95.5242949
"STX5","5215 Campbell Rd","Houston","Texas","77041",157900,2021,48201,"Harris","Mini Fulfillment Center/ Amazon Fresh / Delivery Station for West Houston with Same Day Delivery Service within 45 Minutes Drive Time.","5215 Campbell Rd, Houston, Texas, 77041","Campbell Road, Houston, TX 77041, United States of America",29.8430247,-95.529847
"IIX1","9851 Fallbrook Pines Dr #150","Houston","Texas","77064-3329",111000,2018,48201,"Harris","Specialty Small and Light Products","9851 Fallbrook Pines Dr #150, Houston, Texas, 77064-3329","Fallbrook Dr, Houston, TX, United States of America",29.927503,-95.569335
"HOU7","16225 Tomball Parkway Building 1","Houston","Texas","77064",443500,2021,48201,"Harris","Large Non-Sortable","16225 Tomball Parkway Building 1, Houston, Texas, 77064","Amazon HOU7, 16225 Tomball Parkway, Houston, TX 77064, United States of America",29.940883,-95.5281139
"HOU6","10507 Harlem Road","Richmond","Texas","77407-9563",855000,2021,48157,"Fort Bend","Small Sortable. 5.5 Story building.","10507 Harlem Road, Richmond, Texas, 77407-9563","Amazon HOU6, 10507 Harlem Road, Richmond, TX 77407, United States of America",29.6669586,-95.7128615
"HOU3","31555 US-90 Katy","Brookshire","Texas","77423-2769",1016000,2018,48473,"Waller","Large Non-Sortable","31555 US-90 Katy, Brookshire, Texas, 77423-2769","Katy Fwy, Brookshire, TX, United States of America",29.779364,-95.967495
"STX4","10611 Red Bluff Rd Building 8","Pasadena","Texas","77507",297400,2021,48201,"Harris","Mini Fulfillment Center / Amazon Fresh / Delivery Station for East Houston with Same Day Delivery Service within 45 Minutes Drive Time.","10611 Red Bluff Rd Building 8, Pasadena, Texas, 77507","Red Bluff Rd, Pasadena, TX, United States of America",29.642372,-95.115304
"HOU8","2303 Hurricane LaneFresno","Missouri City","Texas","77545",1008000,2021,48157,"Fort Bend","New Fulfillment Center in Houston","2303 Hurricane LaneFresno, Missouri City, Texas, 77545","Missouri St, Baytown, TX, United States of America",29.720703,-95.003035
"SAT1","6000 Schertz Parkway","Schertz","Texas","78154-1461",1262300,2013,48029,"Bexar","Large Non-Sortable Schertz is nearby San Antonio. TX. Facility Investment $166 Million","6000 Schertz Parkway, Schertz, Texas, 78154-1461","Amazon SAT1, 6000 Schertz Parkway, Schertz, TX 78154, United States of America",29.599867,-98.290999
"STX7","2214 Corner Ridge","San Antonio","Texas","78219",251600,2021,48029,"Bexar","Mini Fulfillment Center / Amazon Fresh / Delivery Station for San Antonio with Same Day Delivery Service within 45 Minutes Drive Time. Sq Ft is an estimate.","2214 Corner Ridge, San Antonio, Texas, 78219","Corner Ridge, San Antonio, TX 78219, United States of America",29.4477176,-98.3913188
"SAT3","6806 Cal Turner Drive","San Antonio","Texas","78220",750000,2022,48029,"Bexar","Small Sortable 4-Story DC Project Star","6806 Cal Turner Drive, San Antonio, Texas, 78220","Cal Turner Drive, San Antonio, TX 78219, United States of America",29.4277564,-98.3593327
"SAT4","10384 W US Hwy 90","San Antonio","Texas","78245-9512",1005000,2021,48029,"Bexar","Non-Sortable Fulfillment Center West of San Antonio","10384 W US Hwy 90, San Antonio, Texas, 78245-9512","W US Hwy 90, San Antonio, TX, United States of America",29.379227,-98.712425
"STX6","1316 New Meister Ln #200","Pflugerville","Texas","78660",150000,2021,48453,"Travis","Mini Fulfillment Center / Amazon Fresh / Delivery Station for Austin with Same Day Delivery Service within 45 Minutes Drive Time. Sq Ft is an estimate","1316 New Meister Ln #200, Pflugerville, Texas, 78660","New Meister Lane, Pflugerville, TX 78664, United States of America",30.4810759,-97.6191748
"AUS2","2000 E Pecan Street Pflugerville","Austin","Texas","78660",823600,2021,48453,"Travis","Small Sortable Project Charm","2000 E Pecan Street Pflugerville, Austin, Texas, 78660","Pecan St E, Pflugerville, TX, United States of America",30.435357,-97.611286
"SAT2","1401 East McCarty Lane","San Marcos","Texas","78666-8969",855000,2016,48209,"Hays","Small Sortable Facility Investment $191 Million","1401 East McCarty Lane, San Marcos, Texas, 78666-8969","Amazon SAT2, 1401 East McCarty Lane, San Marcos, TX 78666, United States of America",29.8373207,-97.9629487
"SAT6","1346 Fortuna Rd","San Marcos","Texas","78666",1005000,2021,48209,"Hays","Non-Sortable Fulfillment Center and Delivery Station","1346 Fortuna Rd, San Marcos, Texas, 78666","Fortuna Road, San Marcos, TX, United States of America",29.9324271,-97.8758177
"PAU2","4500 S Pleasant Valley Road, Ste 201","Austin","Texas","78744",162200,2020,48453,"Travis","Amazon Pharmacy #002 - PillPack Phoenix Distribution Center","4500 S Pleasant Valley Road, Ste 201, Austin, Texas, 78744","South Pleasant Valley Road, Austin, TX 78744, United States of America",30.183195,-97.7453472
"AMA1","2395 N Lakeside Drive ","Amarillo","Texas","79118",1000000,2022,48381,"Randall","Non-Sortable Fulfillment Center Amarillo","2395 N Lakeside Drive , Amarillo, Texas, 79118","2395 North Lakeside Drive, Amarillo, TX 79108, United States of America",35.231242,-101.7417363
"ELP1","12101 Emerald Pass Drive","El Paso","Texas","79928-7808",625000,2021,48141,"El Paso","5-story Small Sortable FC Project William Unit One","12101 Emerald Pass Drive, El Paso, Texas, 79928-7808","Emerald Pass Dr, El Paso, TX, United States of America",31.697282,-106.223131
"DEN8","20500 E Colfax Ave","Aurora","Colorado","80018",1200000,2022,8005,"Arapahoe","Role of Facility TBD","20500 E Colfax Ave, Aurora, Colorado, 80018","East Colfax Avenue, Aurora, CO 80018, United States of America",39.7397883,-104.6963226
"DEN2","22205 E 19th Avenue","Aurora","Colorado","80019",1000000,2017,8001,"Adams","Large Non-Sortable 1.000 associates","22205 E 19th Avenue, Aurora, Colorado, 80019","Amazon DEN2, 22205 East 19th Avenue, Aurora, CO 80019, United States of America",39.7461445,-104.7259895
"DEN7/HDE2","22300 E 26th Ave","Aurora","Colorado","80019",555800,2021,8001,"Adams","DEN7 is a Large Non-Sortable FC. HDE2 is a co-located Heavy/Bulky Delivery Station","22300 E 26th Ave, Aurora, Colorado, 80019","Amazon DEN7, 22300 East 26th Avenue, Aurora, CO 80019, United States of America",39.7521034,-104.7271805
"DEN3/COS1","14601 Grant Street","Thornton","Colorado","80023",855000,2018,8014,"Broomfield","Sortable 1.500 associates","14601 Grant Street, Thornton, Colorado, 80023","Amazon DEN3, 14601 Grant Street, Thornton, CO 80023, United States of America",39.9608062,-104.9851856
"SCO1","6050 Washington Street","Denver","Colorado","80216-1285",159300,2021,8031,"Denver","Mini Fulfillment Center/ Amazon Fresh / Delivery Station for Denver. Same Day Delivery Service within 45 minutes Drive Time","6050 Washington Street, Denver, Colorado, 80216-1285","6050 Washington Street, North Washington, Denver, CO 80216, United States of America",39.8070134,-104.9751162
"","SW Corner County Road 30 and 1-25","Loveland","Colorado","80528",800000,2023,8069,"Larimer","Facility not yet confirmed. 3-story Small Sortable FC. Under Protest.","SW Corner County Road 30 and 1-25, Loveland, Colorado, 80528","Fort Collins, Colorado, United States of America",40.483937,-104.96642
"DEN4","4222 Integration Loop","Colorado Springs","Colorado","80916-5766",640000,2021,8041,"El Paso","Project Rodeo. 5-story Small Sortable FC. Not yet confirmed","4222 Integration Loop, Colorado Springs, Colorado, 80916-5766","Integration Loop, Colorado Springs, CO 80911, United States of America",38.779251,-104.7107145
"BOI2","5295 East Franklin Road","Nampa","Idaho","83687-5548",650000,2020,16027,"Canyon","Project Bronco. Small Sortable. Project delayed 12 -18 months.","5295 East Franklin Road, Nampa, Idaho, 83687-5548","Amazon BOI2, 5295 East Franklin Road, Nampa, ID 83687, United States of America",43.6033664,-116.4988784
"","6259 S Pleasant Valley Road","Nampa","Idaho","83709",1082300,2023,16001,"Ada","Large Non-Sortable FC. Project Dove. Not yet confirmed.","6259 S Pleasant Valley Road, Nampa, Idaho, 83709","Valley St, Boise, ID, United States of America",43.553863,-116.324318
"SLC2","7148 Old Bingham Highway","West Jordan","Utah","84081",100000,2020,49035,"Salt Lake","Non-Sortable Fulfillment Center in Salt Lake City. 1.100 Associates.","7148 Old Bingham Highway, West Jordan, Utah, 84081","Old Bingham Highway, West Jordan, UT 84081, United States of America",40.5707585,-112.0264728
"SLC4","770 South Gladiola Suite 500","Salt Lake City","Utah","84104",638000,2019,49035,"Salt Lake","Specialty Merchandise by Amazon (Private Label)","770 South Gladiola Suite 500, Salt Lake City, Utah, 84104","Gladiola St, Salt Lake City, UT, United States of America",40.754155,-111.972188
"SLC1","777 N 5600 West","Salt Lake City","Utah","84116",855000,2018,49035,"Salt Lake","Small Sortable 3.900 associates","777 N 5600 West, Salt Lake City, Utah, 84116","N 5600 W, Salt Lake City, UT, United States of America",40.78546,-112.025156
"SLC3/HSL1","355 N John Glenn Road","Salt Lake City","Utah","84116-4413",503200,2019,49035,"Salt Lake","SLC3 is a Non-Sortable Fulfillment Center in Salt Lake City HSL9 is a Heavy/Bulky Delivery Station.","355 N John Glenn Road, Salt Lake City, Utah, 84116-4413","John Glenn Rd, Salt Lake City, UT, United States of America",40.77879,-112.036227
"SUT1","6338 W 700 North","Salt Lake City","Utah","84116",150000,2021,49035,"Salt Lake","Mini Fulfillment Center / Amazon Fresh / Delivery Station for Salt Lake City. Same Day Service Within 45 Minute Drive Time.","6338 W 700 North, Salt Lake City, Utah, 84116","West 700 North, Salt Lake City, UT 84116, United States of America",40.784443,-111.9126526
"PPX2","3809 E Watkins St Maricopa","Phoenix","Arizona","85034",129500,NA,4013,"Maricopa","Amazon Pharmacy #002 - PillPack Phoenix Distribution Center","3809 E Watkins St Maricopa, Phoenix, Arizona, 85034","3809 East Watkins Street, Phoenix, AZ 85034, United States of America",33.4241168,-111.9994375
"SAZ1/VAZ1/HPX1","3333 S 7th St","Phoenix","Arizona","85040-1182",149200,2019,4013,"Maricopa","SAZ1 is a Mini Fulfillment Center / Amazon Fresh / Delivery Station for Phoenix Same Day Delivery Service within 45 minutes Drive Time HPX1 is a Heavy/Bulky Delivery Station for Phoenix","3333 S 7th St, Phoenix, Arizona, 85040-1182","Amazon SAZ1, 3333 South 7th Street, Phoenix, AZ 85040, United States of America",33.4161601,-112.0634144
"XUSH","7037 West Van Buren Street","Phoenix","Arizona","85043-3313",543400,2015,4013,"Maricopa","Large Non-Sortable EC Run by 3PL XPO Logistics","7037 West Van Buren Street, Phoenix, Arizona, 85043-3313","7037 West Van Buren Street, Phoenix, AZ 85043, United States of America",33.4515836,-112.2108633
"PHX6/TFC1","4750 & 5050 West Mohave Street","Phoenix","Arizona","85043-8305",120560,2010,4013,"Maricopa","Large Sortable Fulfillment Center in one half of the building Small Sortable Fulfillment Center in the other half","4750 & 5050 West Mohave Street, Phoenix, Arizona, 85043-8305","W Mohave St, Phoenix, AZ, United States of America",33.431184,-112.156568
"PHX7/PHX8/TEN3","800 N 75th Ave","Phoenix","Arizona","85043-3101",1267100,2011,4013,"Maricopa","PHX7 is Large Non-Sortable","800 N 75th Ave, Phoenix, Arizona, 85043-3101","Amazon PHX7, 800 North 75th Avenue, Phoenix, AZ 85043, United States of America",33.4570785,-112.2253997
"TUS1","5333 West Lower Buckeye Rd","Phoenix","Arizona","85043",473200,2017,4013,"Maricopa","Returns Facility","5333 West Lower Buckeye Rd, Phoenix, Arizona, 85043","Amazon TUS1, 5333 West Lower Buckeye Road, Phoenix, AZ 85043, United States of America",33.4209106,-112.175888
"AZA4/HPX2","3333 S 59th Ave","Phoenix","Arizona","85043",554000,2020,4013,"Maricopa","Large Non-Sortable FC. HPX2 is a co- located heavy/bulky delivery station.","3333 S 59th Ave, Phoenix, Arizona, 85043","Amazon AZA4, 3333 South 59th Avenue, Phoenix, AZ 85043, United States of America",33.4170191,-112.1842743
"GYR3/KRB3","8181 W Roosevelt St","Phoenix","Arizona","85043-2356",110000,2020,4013,"Maricopa","GYR3 is a Large Non-Sortable FC. KRB3 is an Amazon Kariba FC (Amazon Basics line of products).","8181 W Roosevelt St, Phoenix, Arizona, 85043-2356","Amazon GYR3, 8181 West Roosevelt Street, Phoenix, AZ 85043, United States of America",33.4575099,-112.2333065
"PHX3","6835 West Buckeye Road","Phoenix","Arizona","85043-4428",1009400,2007,4013,"Maricopa","Legacy Sortable Fulfillment Center Originally opened at 605.000 Sq. Ft and expanded by 400,000 Sq Ft in Dec. 2011","6835 West Buckeye Road, Phoenix, Arizona, 85043-4428","Amazon PHX3, 6835 West Buckeye Road, Phoenix, AZ 85043, United States of America",33.4333242,-112.2077965
"","N side of Pecos Rd between Sossaman & Ellsworth","Mesa","Arizona","85212",635000,2023,4013,"Maricopa","Small Sortable 5-story fulfillment center. Project Thunderbird. Not confirmed yet.","N side of Pecos Rd between Sossaman & Ellsworth, Mesa, Arizona, 85212","Mesa, Arizona, United States of America",33.368263,-111.635998
"GYR4","10205 W Roosevelt St","Avondale","Arizona","85323",242500,2020,4013,"Maricopa","Specialty Merch by Amazon (print on demand service that prints and sells designs uploaded on the internet)","10205 W Roosevelt St, Avondale, Arizona, 85323","West Roosevelt Street, Avondale, AZ 85323, United States of America",33.4569479,-112.305483
"PHX5","16920 W Commerce Dr","Goodyear","Arizona","85338-3620",820400,2008,4013,"Maricopa","Large Non-Sortable Fulfillment Center. Originally opened as PHX4 Delayed Allocation facility at 800.000 Sq. Ft. and expanded to 1.2 Million Sq. Ft by adding 2 x 230,000 sq ft mezzanines in 2011","16920 W Commerce Dr, Goodyear, Arizona, 85338-3620","Amazon PHX5, 16920 West Commerce Drive, Goodyear, AZ 85338, United States of America",33.4121535,-112.4219521
"GYR1","605 143rd Avenue","Goodyear","Arizona","85338",855000,2020,4013,"Maricopa","Amazon Robotics Sortable 4-Story building","605 143rd Avenue, Goodyear, Arizona, 85338","South 143rd Avenue, Goodyear, AZ, United States of America",33.3806254,-112.3683732
"ATS3","8601 W Jefferson St Suite 300","Tolleson","Arizona","85353",184100,2021,4013,"Maricopa","Role of Facility TBD.","8601 W Jefferson St Suite 300, Tolleson, Arizona, 85353","8601 West Jefferson Street, Tolleson, AZ 85353, United States of America",33.4457042,-112.2449891
"PHX9","777 S 79th Ave","Tolleson","Arizona","85353-3140",NA,2015,4013,"Maricopa","PHX9 is a Seasonal Supplemental FC within a Pepsi/Quaker building.","777 S 79th Ave, Tolleson, Arizona, 85353-3140","Amazon PHX9, 777 South 79th Avenue, Phoenix, AZ 85353, United States of America",33.4410429,-112.2272822
"TUS2","6701 S Kolb Road","Tucson","Arizona","85756",857400,2020,4019,"Pima","Small Sortable Also processes returns, light assembly. 3-D printing and direct product pickup by customers from automated kiosks","6701 S Kolb Road, Tucson, Arizona, 85756","Amazon TUS2, 6701 South Kolb Road, South Tucson, Pima County, AZ 85756, United States of America",32.1299359,-110.8386483
"ABQ1","701 Atrisco Vista Blvd","Albuquerque","New Mexico","87120",650000,2021,35001,"Bernalillo","Small Sortable","701 Atrisco Vista Blvd, Albuquerque, New Mexico, 87120","Amazon ABQ1, 701 Atrisco Vista Boulevard Northwest, Albuquerque, NM 87120, United States of America",35.0807372,-106.8044848
"LAS2","3837 Bay Lake Trail Suite 111","North Las Vegas","Nevada","89030-4428",283900,2008,32003,"Clark","Amazon Pantry (FDFC) Return Center","3837 Bay Lake Trail Suite 111, North Las Vegas, Nevada, 89030-4428","3837 Bay Lake Trail, North Las Vegas, NV 89030, United States of America",36.2275416,-115.1032291
"LAS6","4550 Nexus Way","North Las Vegas","Nevada","89081",813100,2017,32003,"Clark","Large Non-Sortable","4550 Nexus Way, North Las Vegas, Nevada, 89081","East Nexus Way, North Las Vegas, NV 89165, United States of America",36.2618445,-115.0787875
"LAS7","6001 E Tropical Parkway","North Las Vegas","Nevada","89115",855000,2019,32003,"Clark","Small Sortable. Amazon Fresh is Likely in this Building as well.","6001 E Tropical Parkway, North Las Vegas, Nevada, 89115","East Tropical Parkway, North Las Vegas, NV 89115, United States of America",36.2689153,-115.0231499
"LAS8/LAS9","5801 N Nicco Way","North Las Vegas","Nevada","89115",341300,2020,32003,"Clark","Merch by Amazon and Print on Demand.","5801 N Nicco Way, North Las Vegas, Nevada, 89115","North Nicco Way, North Las Vegas, NV 89115, United States of America",36.2626289,-115.0478469
"IVSE","2951 Marion Drive Unit 101","North Las Vegas","Nevada","89115",475000,2018,32003,"Clark","Specialty Small and Light Products","2951 Marion Drive Unit 101, North Las Vegas, Nevada, 89115","Marion Dr, Las Vegas, NV, United States of America",36.213346,-115.071212
"IVSF","2921 Marion Drive Unit 109","North Las Vegas","Nevada","89115",676000,2018,32003,"Clark","Specialty Small and Light Products","2921 Marion Drive Unit 109, North Las Vegas, Nevada, 89115","Marion Dr, Las Vegas, NV, United States of America",36.212803,-115.071213
"VGT1","5802 E Tropical Parkway","North Las Vegas","Nevada","89115",855000,2021,32003,"Clark","Small Sortable","5802 E Tropical Parkway, North Las Vegas, Nevada, 89115","Amazon VGT1, 5802 East Tropical Parkway, North Las Vegas, NV 89115, United States of America",36.2718262,-115.0439926
"SNV1","7970 S Valley View Blvd, Suite 130","Las Vegas","Nevada","89139",150000,2021,32003,"Clark","Mini Fulfillment Center / Amazon Fresh / Delivery Station for Las Vegas with Same Day Delivery Service within 45 Minutes Drive Time. Sq Ft is an Estimate.","7970 S Valley View Blvd, Suite 130, Las Vegas, Nevada, 89139","South Valley View Boulevard, Las Vegas, NV 89102, United States of America",36.1310213,-115.1901761
"RNO4","8000 North Virginia Street","Reno","Nevada","89506",634000,2015,32031,"Washoe","Large and Bulk Goods Facility replaced the Fernley, Nevada FC","8000 North Virginia Street, Reno, Nevada, 89506","Amazon RNO4, 8000 North Virginia Street, Reno, NV 89506, United States of America",39.6038686,-119.8484185
"LGB1","2417 E Carson St","Long Beach","California","90810",468100,NA,6037,"Los Angeles","Supplemental Seasonal FC","2417 E Carson St, Long Beach, California, 90810","East Carson Street, Long Beach, CA 90810, United States of America",33.8317353,-118.2161678
"XLA3","16047 Cypress Ave","Chino","California","91708",613800,2020,6071,"San Bernardino","Large Non-Sortable Operated by 3PL NFI Industries Sq Ft is an estimate","16047 Cypress Ave, Chino, California, 91708","16047 Cypress Avenue, Chino, CA 91708, United States of America",33.9670623,-117.6624982
